{
  "schema_version": 2,
  "uid": "ee8512d4fe6c46419275cb825c36ae65",
  "protocol": "C",
  "name": "prosta zmiana",
  "project": "sdlc",
  "description": "Podbicie wskaźnika docs/sdlc do rewizji scalenia pull requesta #11.",
  "migration_gaps": [],
  "started": "20260914T121857Z",
  "agent": {
    "name": "Claude Opus 5",
    "sessions": [
      "session_017yTkWjvYhbAThbwmun24ee"
    ]
  },
  "interactions": 2,
  "corrections": [],
  "measurements": {
    "escalations": {
      "definition": "ile razy praca wróciła do planowania, bo dotykała zachowania",
      "value": 0
    },
    "files_changed": {
      "definition": "zmienione pliki",
      "value": 2
    },
    "gate_failures": {
      "definition": "przebiegi weryfikacji z wynikiem FAIL",
      "value": 0
    },
    "owner_stops": {
      "definition": "zatrzymania po decyzję właściciela",
      "value": 1
    },
    "plan_revisions": {
      "definition": "zmiany planu przebiegu po jego zatwierdzeniu",
      "value": 0
    }
  },
  "finished": "20260914T122103Z"
}
