{
  "schema_version": 2,
  "uid": "24d010fe6723404f847c1e27718e82f1",
  "protocol": "Y",
  "name": "wydanie wersji konwencji",
  "project": "convention-python",
  "description": "Wydanie konwencji w wersji v1.7.1",
  "migration_gaps": [],
  "started": "20260919T203624Z",
  "agent": {
    "name": "Claude Opus 5",
    "sessions": [
      "session_01VH5AP9LcYSRrtWmhLAJfxM"
    ]
  },
  "interactions": 1,
  "corrections": [],
  "measurements": {
    "decisions_added": {
      "definition": "decyzje, które doszły w zasobie",
      "value": 0
    },
    "decisions_changed": {
      "definition": "decyzje o zmienionej treści",
      "value": 0
    },
    "decisions_removed": {
      "definition": "decyzje zniesione",
      "value": 0
    },
    "decisions_renumbered": {
      "definition": "decyzje, które zmieniły identyfikator albo właściciela",
      "value": 0
    },
    "documents_adapted": {
      "definition": "dokumenty projektu zmienione przez migrację",
      "value": 0
    },
    "gate_failures": {
      "definition": "przebiegi weryfikacji z wynikiem FAIL",
      "value": 0
    },
    "owner_conflicts": {
      "definition": "kolizje reguły zasobu z decyzją projektu",
      "value": 0
    },
    "plan_revisions": {
      "definition": "zmiany planu przebiegu po jego zatwierdzeniu",
      "value": 0
    },
    "references_fixed": {
      "definition": "poprawione odwołania do decyzji i do plików",
      "value": 0
    }
  },
  "finished": "20260920T044253Z"
}
