{
  "schema_version": 2,
  "uid": "f0bbf28e756642a2aeb2dcb8078bf66e",
  "protocol": "D",
  "name": "przegląd inboxa",
  "project": "sdlc",
  "description": "Rozstrzygnięcie wpisu o poleceniu versions w repozytorium, w którym zasób powstaje",
  "migration_gaps": [],
  "started": "20260920T081126Z",
  "agent": {
    "name": "nieznany",
    "sessions": [
      "nieznana"
    ]
  },
  "interactions": 3,
  "corrections": [],
  "measurements": {
    "entries_planned": {
      "definition": "wpisy skierowane do planowania",
      "value": 1
    },
    "entries_rejected": {
      "definition": "wpisy odrzucone",
      "value": 0
    },
    "entries_research": {
      "definition": "wpisy skierowane na rozpoznanie",
      "value": 0
    },
    "entries_reviewed": {
      "definition": "wpisy wzięte pod uwagę",
      "value": 1
    },
    "entries_simple": {
      "definition": "wpisy załatwione prostą zmianą",
      "value": 0
    },
    "owner_rounds": {
      "definition": "ile razy czekano na decyzję właściciela",
      "value": 1
    },
    "plan_revisions": {
      "definition": "zmiany planu przebiegu po jego zatwierdzeniu",
      "value": 0
    }
  },
  "finished": "20260921T041050Z"
}
