{
  "schema_version": 2,
  "uid": "5cdd1a807ca044e0a3dc6d75ef328097",
  "protocol": "C",
  "name": "prosta zmiana",
  "project": "convention-python",
  "description": "wpisy do inboxa o trzech usterkach skryptów protokołu",
  "migration_gaps": [],
  "started": "20260913T072610Z",
  "agent": {
    "name": "nieznany",
    "sessions": [
      "nieznana"
    ]
  },
  "interactions": 2,
  "corrections": [],
  "measurements": {
    "escalations": {
      "definition": "ile razy praca wróciła do planowania, bo dotykała zachowania",
      "value": 0
    },
    "files_changed": {
      "definition": "zmienione pliki",
      "value": 4
    },
    "gate_failures": {
      "definition": "przebiegi weryfikacji z wynikiem FAIL",
      "value": 0
    },
    "owner_stops": {
      "definition": "zatrzymania po decyzję właściciela",
      "value": 2
    },
    "plan_revisions": {
      "definition": "zmiany planu przebiegu po jego zatwierdzeniu",
      "value": 0
    }
  },
  "finished": "20260913T072952Z"
}
