{
  "schema_version": 2,
  "uid": "32f80e74eff6434db1c79b06256dc763",
  "protocol": "Z",
  "name": "wydanie i migracja wersji procesu",
  "project": "sdlc",
  "description": "Wydanie procesu w wersji v10.0.0: pull request z zamknięcia, Protokół 7 scalania, przegląd w indeksie.",
  "migration_gaps": [],
  "started": "20260921T115251Z",
  "agent": {
    "name": "Claude Opus 5",
    "sessions": [
      "978dd94b-7822-4e06-b726-d32ac4429707"
    ]
  },
  "interactions": 2,
  "corrections": [],
  "measurements": {
    "decisions_added": {
      "definition": "decyzje, które doszły w zasobie",
      "value": 2
    },
    "decisions_changed": {
      "definition": "decyzje o zmienionej treści",
      "value": 3
    },
    "decisions_removed": {
      "definition": "decyzje zniesione",
      "value": 0
    },
    "decisions_renumbered": {
      "definition": "decyzje, które zmieniły identyfikator albo właściciela",
      "value": 0
    },
    "documents_adapted": {
      "definition": "dokumenty projektu zmienione przez migrację",
      "value": 0
    },
    "gate_failures": {
      "definition": "przebiegi weryfikacji z wynikiem FAIL",
      "value": 0
    },
    "owner_conflicts": {
      "definition": "kolizje reguły zasobu z decyzją projektu",
      "value": 0
    },
    "plan_revisions": {
      "definition": "zmiany planu przebiegu po jego zatwierdzeniu",
      "value": 0
    },
    "protocols_adapted": {
      "definition": "protokoły projektu zmienione przez migrację",
      "value": 0
    },
    "protocols_added": {
      "definition": "protokoły dodane, bo doszły w procesie",
      "value": 0
    },
    "protocols_removed": {
      "definition": "protokoły usunięte, bo zniknęły w procesie",
      "value": 0
    },
    "references_fixed": {
      "definition": "poprawione odwołania do decyzji i do plików",
      "value": 0
    }
  },
  "finished": "20260921T123923Z"
}
