{
  "schema_version": 2,
  "uid": "7cd810fb043c49afaeb1b0b2fb94a3c7",
  "protocol": "Y",
  "name": "migracja wersji konwencji",
  "project": "sdlc",
  "description": "Przeniesienie repozytorium na konwencję Pythona v1.1.0 z wnętrza realizacji dekompozycji weryfikacji.",
  "migration_gaps": [],
  "started": "20260914T093215Z",
  "agent": {
    "name": "Claude Opus 5",
    "sessions": [
      "session_017yTkWjvYhbAThbwmun24ee"
    ]
  },
  "interactions": 1,
  "corrections": [],
  "measurements": {
    "decisions_added": {
      "definition": "decyzje, które doszły w zasobie",
      "value": 1
    },
    "decisions_changed": {
      "definition": "decyzje o zmienionej treści",
      "value": 0
    },
    "decisions_removed": {
      "definition": "decyzje zniesione",
      "value": 0
    },
    "decisions_renumbered": {
      "definition": "decyzje, które zmieniły identyfikator albo właściciela",
      "value": 0
    },
    "documents_adapted": {
      "definition": "dokumenty projektu zmienione przez migrację",
      "value": 0
    },
    "gate_failures": {
      "definition": "przebiegi weryfikacji z wynikiem FAIL",
      "value": 0
    },
    "owner_conflicts": {
      "definition": "kolizje reguły zasobu z decyzją projektu",
      "value": 0
    },
    "plan_revisions": {
      "definition": "zmiany planu przebiegu po jego zatwierdzeniu",
      "value": 0
    },
    "references_fixed": {
      "definition": "poprawione odwołania do decyzji i do plików",
      "value": 0
    }
  },
  "finished": "20260914T094007Z"
}
