{
  "schema_version": 2,
  "uid": "cc11e817de9848218dcdea0c0afd73f7",
  "protocol": "A",
  "name": "planowanie zmiany",
  "project": "sdlc",
  "description": "Migracja znaczników rodzaju pliku",
  "migration_gaps": [],
  "started": "20260919T105125Z",
  "agent": {
    "name": "nieznany",
    "sessions": [
      "nieznana"
    ]
  },
  "interactions": 0,
  "corrections": [],
  "measurements": {
    "approval_rounds": {
      "definition": "ile razy przedstawiono projekt zmiany do zatwierdzenia",
      "value": 0
    },
    "closure_loops": {
      "definition": "przebiegi pętli domknięcia",
      "value": 0
    },
    "gate_failures": {
      "definition": "przebiegi weryfikacji z wynikiem FAIL",
      "value": 0
    },
    "plan_questions": {
      "definition": "pytania przedstawione właścicielowi",
      "value": 0
    },
    "plan_revisions": {
      "definition": "zmiany planu przebiegu po jego zatwierdzeniu",
      "value": 0
    },
    "question_rounds": {
      "definition": "ile razy praca zatrzymała się na pytaniach",
      "value": 0
    },
    "research_requests": {
      "definition": "pytania o zgodę na oparcie się na materiale badawczym",
      "value": 0
    }
  },
  "finished": "20260919T105559Z"
}
