{
  "schema_version": 2,
  "uid": "b76c69e1faa74eff8b02faa7ec022103",
  "protocol": "C",
  "name": "prosta zmiana",
  "project": "sdlc",
  "description": "Dopisanie nawrotu usterki wyrównania submodułu metryk do wpisu inboxa.",
  "migration_gaps": [],
  "started": "20260913T073624Z",
  "agent": {
    "name": "Claude Opus 5",
    "sessions": [
      "session_015j9xSzGvc28aZ8XzTEj3XY"
    ]
  },
  "interactions": 5,
  "corrections": [],
  "measurements": {
    "escalations": {
      "definition": "ile razy praca wróciła do planowania, bo dotykała zachowania",
      "value": 0
    },
    "files_changed": {
      "definition": "zmienione pliki",
      "value": 2
    },
    "gate_failures": {
      "definition": "przebiegi weryfikacji z wynikiem FAIL",
      "value": 0
    },
    "owner_stops": {
      "definition": "zatrzymania po decyzję właściciela",
      "value": 2
    },
    "plan_revisions": {
      "definition": "zmiany planu przebiegu po jego zatwierdzeniu",
      "value": 0
    }
  },
  "finished": "20260913T084406Z"
}
