{
  "schema_version": 2,
  "uid": "9c95b846afa04c50b54cabef8e428c8e",
  "protocol": "C",
  "name": "prosta zmiana",
  "project": "sdlc",
  "description": "Wpisy inboxa po testach wydajnościowych",
  "migration_gaps": [],
  "started": "20260919T165129Z",
  "agent": {
    "name": "Claude Opus 5",
    "sessions": [
      "session_01VH5AP9LcYSRrtWmhLAJfxM"
    ]
  },
  "interactions": 1,
  "corrections": [],
  "measurements": {
    "escalations": {
      "definition": "ile razy praca wróciła do planowania, bo dotykała zachowania",
      "value": 0
    },
    "files_changed": {
      "definition": "zmienione pliki",
      "value": 2
    },
    "gate_failures": {
      "definition": "przebiegi weryfikacji z wynikiem FAIL",
      "value": 1
    },
    "owner_stops": {
      "definition": "zatrzymania po decyzję właściciela",
      "value": 0
    },
    "plan_revisions": {
      "definition": "zmiany planu przebiegu po jego zatwierdzeniu",
      "value": 0
    }
  },
  "finished": "20260919T165442Z"
}
