{
  "schema_version": 2,
  "uid": "1d1bffe349224469aecc1e12a99a4d63",
  "protocol": "B",
  "name": "realizacja projektu zmiany",
  "project": "sdlc",
  "description": "Deskryptory przebiegu w YAML",
  "migration_gaps": [],
  "started": "20260916T155152Z",
  "agent": {
    "name": "Claude Opus 5",
    "sessions": [
      "nieznana"
    ]
  },
  "interactions": 5,
  "corrections": [],
  "measurements": {
    "gate_failures": {
      "definition": "przebiegi weryfikacji z wynikiem FAIL",
      "value": 1
    },
    "plan_gaps": {
      "definition": "ile razy projekt zmiany okazał się zły albo niepełny",
      "value": 1
    },
    "plan_revisions": {
      "definition": "zmiany planu przebiegu po jego zatwierdzeniu",
      "value": 1
    },
    "repositories_touched": {
      "definition": "repozytoria, które dostały commit",
      "value": 3
    },
    "review_corrections": {
      "definition": "odpowiedzi „poprawki” w pętli przeglądu",
      "value": 0
    },
    "review_rounds": {
      "definition": "prośby o przegląd",
      "value": 1
    },
    "scope_conflicts": {
      "definition": "uwagi wykraczające poza sekcję „Poza zakresem”",
      "value": 0
    },
    "steps_deviated": {
      "definition": "kroki, których wynik rozjechał się z zapisanym",
      "value": 1
    },
    "steps_total": {
      "definition": "kroki wykonawcze zapisane w projekcie zmiany",
      "value": 6
    }
  },
  "finished": "20260916T163019Z"
}
