{
  "schema_version": 2,
  "uid": "2812206d9997437aa425e81368ee6967",
  "protocol": "Y",
  "name": "migracja wersji konwencji",
  "project": "sdlc",
  "description": "Przejście na wersję v1.3.1 konwencji Pythona",
  "migration_gaps": [],
  "started": "20260916T100145Z",
  "agent": {
    "name": "Claude Opus 5",
    "sessions": [
      "nieznana"
    ]
  },
  "interactions": 1,
  "corrections": [],
  "measurements": {
    "decisions_added": {
      "definition": "decyzje, które doszły w zasobie",
      "value": 0
    },
    "decisions_changed": {
      "definition": "decyzje o zmienionej treści",
      "value": 0
    },
    "decisions_removed": {
      "definition": "decyzje zniesione",
      "value": 0
    },
    "decisions_renumbered": {
      "definition": "decyzje, które zmieniły identyfikator albo właściciela",
      "value": 0
    },
    "documents_adapted": {
      "definition": "dokumenty projektu zmienione przez migrację",
      "value": 0
    },
    "gate_failures": {
      "definition": "przebiegi weryfikacji z wynikiem FAIL",
      "value": 0
    },
    "owner_conflicts": {
      "definition": "kolizje reguły zasobu z decyzją projektu",
      "value": 0
    },
    "plan_revisions": {
      "definition": "zmiany planu przebiegu po jego zatwierdzeniu",
      "value": 0
    },
    "references_fixed": {
      "definition": "poprawione odwołania do decyzji i do plików",
      "value": 0
    }
  },
  "finished": "20260916T144740Z"
}
